{"operation_id":"op_save_golden","base_revision_id":"revision_golden","document":{"schema_version":1,"asset_revision_id":"asset_revision_golden","ontology_version_id":"ontology_v1","coordinate_space":{"type":"canonical_image_pixels","width":640,"height":480},"completion":"in_progress","objects":[{"object_id":"object_person_001","label_id":"label_person","geometry":{"type":"bbox_xyxy","x_min":10.0,"y_min":20.0,"x_max":110.0,"y_max":220.0},"attributes":{"helmet_state":"unknown"},"origin":{"type":"manual","prediction_id":null,"model_run_id":null,"import_batch_id":null}}]},"lease":null,"suggestion_decisions":[]}